type_name,type_kind,field_name,field_type,is_required,description,args
Order,OBJECT,subtotalLineItemsQuantity,Int!,True,"The sum of quantities for all line items that contribute to the order's subtotal price.
This excludes quantities for items like tips, shipping costs, or gift cards that don't affect the subtotal.
Use this to quickly understand the total item count for pricing calculations.",
Order,OBJECT,subtotalPriceSet,MoneyBag,False,"The sum of the prices for all line items after discounts and before returns, in shop and presentment currencies.
If `taxesIncluded` is `true`, then the subtotal also includes tax.",
Order,OBJECT,suggestedRefund,SuggestedRefund,False,"A calculated refund suggestion for the order based on specified line items, shipping, and duties.
Use this to preview refund amounts, taxes, and processing fees before creating an actual refund.","shippingAmount: Money, refundShipping: Boolean, refundLineItems: [RefundLineItemInput!], refundDuties: [RefundDutyInput!], suggestFullRefund: Boolean = false, refundMethodAllocation: RefundMethodAllocation = ORIGINAL_PAYMENT_METHODS"
Order,OBJECT,tags,[String!]!,True,"A comma separated list of tags associated with the order. Updating `tags` overwrites
any existing tags that were previously added to the order. To add new tags without overwriting
existing tags, use the [tagsAdd](https://shopify.dev/api/admin-graphql/latest/mutations/tagsadd)
mutation.",
Order,OBJECT,taxExempt,Boolean!,True,"Whether taxes are exempt on the order.
Returns `true` for orders where the customer or business has a valid tax exemption, such as non-profit organizations or tax-free purchases.
Use this to understand if tax calculations were skipped during checkout.",
Order,OBJECT,taxLines,[TaxLine!]!,True,"A list of all tax lines applied to line items on the order, before returns.
Tax line prices represent the total price for all tax lines with the same `rate` and `title`.",
Order,OBJECT,taxesIncluded,Boolean!,True,"Whether taxes are included in the subtotal price of the order.
When `true`, the subtotal and line item prices include tax amounts. When `false`, taxes are calculated and displayed separately.",
Order,OBJECT,test,Boolean!,True,"Whether the order is a test.
Test orders are made using the Shopify Bogus Gateway or a payment provider with test mode enabled.
A test order can't be converted into a real order and vice versa.",
Order,OBJECT,totalCapturableSet,MoneyBag!,True,"The authorized amount that's uncaptured or undercaptured, in shop and presentment currencies.
This amount isn't adjusted for returns.",
Order,OBJECT,totalCashRoundingAdjustment,CashRoundingAdjustment!,True,The total rounding adjustment applied to payments or refunds for an order involving cash payments. Applies to some countries where cash transactions are rounded to the nearest currency denomination.,
Order,OBJECT,totalDiscountsSet,MoneyBag,False,"The total amount discounted on the order before returns, in shop and presentment currencies.
This includes both order and line level discounts.",
Order,OBJECT,totalOutstandingSet,MoneyBag!,True,"The total amount not yet transacted for the order, in shop and presentment currencies.
A positive value indicates a difference in the merchant's favor (payment from customer to merchant) and a negative value indicates a difference in the customer's favor (refund from merchant to customer).",
Order,OBJECT,totalPriceSet,MoneyBag!,True,"The total price of the order, before returns, in shop and presentment currencies.
This includes taxes and discounts.",
Order,OBJECT,totalReceivedSet,MoneyBag!,True,"The total amount received from the customer before returns, in shop and presentment currencies.",
Order,OBJECT,totalRefundedSet,MoneyBag!,True,"The total amount that was refunded, in shop and presentment currencies.",
Order,OBJECT,totalRefundedShippingSet,MoneyBag!,True,"The total amount of shipping that was refunded, in shop and presentment currencies.",
Order,OBJECT,totalShippingPriceSet,MoneyBag!,True,"The total shipping costs returned to the customer, in shop and presentment currencies. This includes fees and any related discounts that were refunded.",
Order,OBJECT,totalTaxSet,MoneyBag,False,"The total tax amount before returns, in shop and presentment currencies.",
Order,OBJECT,totalTipReceivedSet,MoneyBag!,True,"The sum of all tip amounts for the order, in shop and presentment currencies.",
Order,OBJECT,totalWeight,UnsignedInt64,False,"The total weight of the order before returns, in grams.",
Order,OBJECT,transactions,[OrderTransaction!]!,True,A list of transactions associated with the order.,"first: Int, capturable: Boolean, manuallyResolvable: Boolean"
Order,OBJECT,transactionsCount,Count,False,The number of transactions associated with the order.,
Order,OBJECT,unpaid,Boolean!,True,Whether no payments have been made for the order.,
Order,OBJECT,updatedAt,DateTime!,True,The date and time in [ISO 8601 format](https://en.wikipedia.org/wiki/ISO_8601) when the order was last modified.,
